SJJ wrote a review May 2019,50,Mumbai - Bengaluru,Domestic,Business Class,Excellent!,"The flight and services were very good. The cabin crew was excellent .. very professional, pleasant and helpful (especially Thamanna) Food and service was excellent. It made me think that the excellent service culture of Singapore Airlines has rubbed off on Vistara too. I hope they keep it us as they expand and grow. Looking forward to them becoming international! definitely will use them whenever i get a chance."
NVPARIKH wrote a review May 2019,50,New Delhi - Ahmedabad,Domestic,Economy,The best in Indian Skies.....!,"The best airine so far that I have flown in India till date. Teh staff was extremely well mannered and courteus. The comfort was much better. The food served was decent, good in portion but still some room for improvemnt on the taste. The flight was very smooth and even though we hit a bit of turbulance mid air, but overall the pilots made it very smmoth. It is good to see once again the name Tata and Singapore together on an airline, makes you confident, comfortable auusured even before you board, would love to fly everytime. Thank you very much."
saurabh_dhingra10 wrote a review May 2019,40,New Delhi - Bengaluru,Domestic,Economy,Hospitality is wonderful,"I would highly recommend vistara to everyone. Hospitality on flight is wonderful. Food served is of apt quantity and also taste well. My return flight was a little choppy though, ideally nothing to do with flight but I guess it definitely impacts your experience. Overall everything fine about the flight."
Ajay C wrote a review May 2019,50,Mumbai - New Delhi,Domestic,Premium Economy,Service Par Excellence,"I was given an upgrade of one class being my birthday month. Fortunately I was able to avail the upgrade. Fortunately, because just one person took the interest to make it happen. The others starting from the checkin counter to the counter at the gate didn't really care. The only person who ensured the upgrade was Tauseef (I hope I have the right name and spelling).
The service by the Flight Attendant in the Premium Economy, Sagar, was outstanding. He was humble, polite, attentive and discreet. The few minutes of interaction with Sagar made the flight truly worthwhile.
The passenger in the row on the other side of the aisle required assistance. Sagar was there for him too.
The snacks served had a appetising aroma and were delicious. I feel the portion size could be increased by at least another 15 to 20 percent."
Abhyudaya wrote a review May 2019,40,Mumbai - Kolkata,Domestic,Premium Economy,Inaugural travel,"Comfortable seating, good food and great service. The staff was courteous and food was plenty. Had a pleasant inaugural flight on Vistara. The airport experience was pleasant. Not sure why I was asked to tag my hand luggage, when certain airports have been exempted."
Jayaraj K wrote a review May 2019,50,New Delhi - Kochi (Cochin),Domestic,Economy,Good experience & wonderful service,it was our first flying experience with Vistara and we are really happy with the quality of service and the very kind and helpful staff. we would rate Vistara above all the other economy carriers which we had travelled over the last few years. right from check-in to the destination everything was smooth. the inflight catering is also well managed and served good food. We are proud of TATA and glad that they keep the customer service levels very high. Keep up the good spirits!!
vivin wrote a review May 2019,10,Bengaluru - Mumbai,Domestic,Economy,Worst Customer service ever by an airline,"I had escalated an issue 4 days back on 17th May 2019 and they have still not responded I had to call them again and again but no solution provided they keep on saying 24hrs every time I speak to their customer care .

I have escalated a similar issue with indigo for my return ticket and they have now closed the issue with the refund altogether"
weyeskay w wrote a review May 2019,30,Bengaluru - New Delhi,Domestic,Economy,Long way to go,"Food is average in economy
Service is very slow
Knowledge about security is low
The only option for passengers after Jet airways went down"
SiddharthDhamija wrote a review May 2019,40,New Delhi - Bengaluru,Domestic,Premium Economy,Airlines started off very well but it seems that that they are not able to cope with the new load factor,"Till few weeks back, flying on Vistara was like a breeze of fresh air. However, it seems that with Jet Airways closing down, business travelers are all moving to Vistara and this is something which they are not able to cope up with on a daily basis. Quality of food is going down by the day; Airline staff is definitely not able to manage a sudden rush of people boarding the flight; crew on board looks stressed and over worked. My other issue with Vistara is that they don’t allow checking on to emergency row seat when one does a web check-in. Unlike all other airlines in the world who issue emergency row seats(and checking the physical state of passenger while boarding the flight) during web check-in, Vistara for some strange reasons does not allow this. What this means is that every time that I have to fly on Vistara, I need to be present 3 hours before my flight at the airport so that I can be lucky enough to get an emergency row seat in economy class."
Mudhit G wrote a review May 2019,50,New Delhi - Mumbai,Domestic,Business Class,Best domestic business class,The best domestic business class in India for sure. Extremely comfortable seats. The food was excellent and the service was 10 on 10
harsh j wrote a review May 2019,40,Mumbai - Kolkata,Domestic,Premium Economy,i was upgraded to premium economy and it was a very pleasant experience,"their service is excellent and the staff is helpful whether you are in economy or premium
food is amazing checkin could be improved though"
Ajay C wrote a review May 2019,40,New Delhi - Mumbai,Domestic,Economy,Comfortable and Pleasant,"The overall experience at the end was that it was a comfortable flight. The boarding process itself was non eventful. Fortunately the middle seat was vacant, so there was no clash of elbows. The cabin crew was courteous, yet somehow I felt that warmth I've seen on other Vistara flights, was missing. The aroma was the snack served helped whip up an appetite. Alas! It was a snack and not a meal, yet one which was relished."
The Oberoi wrote a review May 2019,50,New Delhi - Chennai,Domestic,Premium Economy,Feedback of VISTARA AIRLINE for Delhi to Chennai flight,"Excellent experience with Vistara Airline From New Delhi to Chennai . First of all your Pilots and Air-Hostess are very well Educated people . Deeply take care about very little things in flight. Your planes are very nice and beautiful from inside. Good gentry is present in the plane. Food is not of our choice, but having good quality. It appears that Chennai is not far away. We will come again in your flight. Your staff at counters at airport is very nice . Your Airline suits us . We are very comfortable with your Airline."
Mukul Mehta wrote a review May 2019,50,Jammu City - New Delhi,Domestic,Economy,Couldn’t fault this airliner. True professional for the first flight .,"This one is here to stay. Great ground handling and information communication. Spot on counter staff and above all an ex excellent inflight experience during this short flight.
The only awkward experience that I wanted to buy some food and all the three credit cards did not go through. There seems to be something wrong with the machine as it couldn’t be coincidental they Amex, master and visa couldn’t work at the same time. The crew was professional and apologetic."
Radhika Agarwal wrote a review May 2019,40,Mumbai - Amritsar,Domestic,Economy,1st Vistara Flight,"It was my 1st Vistara flight experience. I am really appreciative of their quality of food & service level. patience level of air hostesses was outstanding as my 2 kids of 8 & 5 years were truly demanding to them as well..

Another example of Tata group hospitality. I am huge fan of Taj group & noe Vistara as well"
aritradatta538 wrote a review May 2019,20,Chennai - Kolkata,Domestic,Premium Economy,Limited amount of leg room,The flight has a limited amount of leg room . Overall it was good the food is good but they provide us with only some Indian meal. Flight attendant were good and polite. Overall it was a good experience.
zen tome wrote a review May 2019,50,Kochi (Cochin) - New Delhi,Domestic,Premium Economy,My first choice for travel in India now.,"Premium economy is worth every rupee. Priority check in, Priority boarding. Really nice to board quickly without the crowd and lines. I think seats had more leg room. Service was very good. On a 3 hr flight it was nice to get lunch. Biggest thing for me was getting to luggage belt on arrival and seeing my bag come out one of the first. It had a big sticker - ""Priority Luggage"". Indigo used to be very good at getting luggage out quickly but no more. I hope Vistara keeps up the level of service. All the little details make the trip so much more pleasant."
Sunil wrote a review May 2019,40,Bengaluru - New Delhi,Domestic,Premium Economy,Best in service,There was a time some airlines company started beating customer but this vistara airlines proved there customer satisfaction is the first priority. It was good build quality of aircraft with good interior and well cushioned seats and smile crew
JPStarr wrote a review May 2019,50,Bagdogra - New Delhi,Domestic,Business Class,Clean and Efficient,"We flew round trip from Delhi to Bagdogra on Vistara and enjoyed both legs. We flew in economy on the outbound leg and purchased a gate upgrade to Business Class on the return leg. The plane was exceptionally clean, the staff impeccably dressed and both check-in and flight experience were excellent. I would rate their overall service very highly."
kartikey s wrote a review May 2019,50,Mumbai - New Delhi,Domestic,Economy,Tata lives up to its name,An excellent experience. The airlines seats were nice and had a good leg room. The refreshments offered onboard were fresh and delicious. The airline staff was helpful and friendly. Genuinely the airlines lives up to the name of the Tata franchise.
"Lech B.Kowalski, LLM wrote a review May 2019",50,Varanasi - New Delhi,Domestic,Economy,My favorite airline in India,"Service of this airline is excellent in every respect. The crew is friendly towards
passengers and the meals served during the flights delicious. Moreover, I was
privileged with priority boarding at no extra charge."
Aditya M wrote a review May 2019,50,Ahmedabad - New Delhi,Domestic,Economy,Best airline,"Very polite and helpfull staff , offered assistance at every level. In class of service will definitely rate vistara on top of all airlines of india. Although the fares are comparablly little higher than other airlines."
Dharmesh Thakkar wrote a review May 2019,50,Mumbai - New Delhi,Domestic,Economy,Best Service,I must admire their service. Invariably flights are on time and food served onboard is delicious. Have tried breakfast lunch and dinner as i have travelled recently on all different times with vistara. Airplanes are also clean and in decent condition. Its advisable that you inform them at the time of checkin if u have a fraglie checked in bagage so that they pur handle with care sticker on it. This airline is worth paying extra money.
Pervin D wrote a review May 2019,50,Mumbai - Amritsar,Domestic,Premium Economy,Class one airline in India,Amazing service Prompt communication Comfortable seating Great meals and Smiling and helpful staff. Right from check in to baggage collection Vistara has proved to be an excellent choice for the Indian travellers in terms of service and comfort. I am glad they are expanding their network as there are not too many cities connected and am looking forward to many more travels with costars considering so am a regular traveller
hdpaolo wrote a review May 2019,50,New Delhi - Pune,Domestic,Economy,Trip to Pune,"Very good service.
The seats even if in economy are very comfortable and the flight was on time.
To be reccomended for a another trip"
Ashish Rawat wrote a review May 2019,50,New Delhi - Ranchi,Domestic,Economy,‘The best feeling of being in the Sky’,"I have travelled in all the Indian Carriers but the feeling of flying in Vistara is something really different and new feeling always. From the past two years, I am flying only in Vistara( Domestic Routes) and every journey with them is always different and memorable. New Aircraft’s, supportive Cabin crew members , delicious food in all varieties and their timely arrivals in every place. I cannot express much more but yes I am in love with the Vistara feeling.
I would recommend everyone to atleast fly once in Vistara to experience new feeling.
5⭐️⭐️⭐️⭐️⭐️"
sheikh Irshad Ahmad wrote a review May 2019,50,New Delhi - Srinagar,Domestic,Economy,Delightful,The hospitality and care of the crew members was very helpful in all respects. We enjoyed their company till the end of the journey. Be blessed.
sh_mohanlal wrote a review May 2019,50,Ahmedabad - New Delhi,Domestic,Business Class,journey home,excellent journey staff ws there at check in and helped during flight very good service food was sumptuous and hot
V Narendran wrote a review May 2019,40,Mumbai - Bengaluru,Domestic,Economy,Excellent economy experience. Tasty meal onboard,Great experience even in economy. Food served was hot steaming idlli sambar and pongal. Very well packaged. Comfortable seating.
mayank4s wrote a review May 2019,40,Mumbai - New Delhi,Domestic,Economy,One of the best carriers,Best in class cabin with respect to legroom and inflight hospitality and the food option is decent that currently makes this airline the best after jet ( no longer operates )
AF1960yas wrote a review May 2019,50,Pune - Hyderabad,Domestic,Economy,Vistara Good Airlines to fly with.,"This was my second time flying with Vistara. Two years ago we flew from Pune to Delhi. At that time I was not aware that Vistara only goes to International Airports. We were walking out at the Delhi airport and I felt something was different because we were walking endlessly for the baggage and exit. Anyway we were April, since my husband and I are both above 80 we had opted for wheelchairs. Our baggage was screened, wheelchairs were there to take us for our boarding passes. The staff at the counter were very polite and courteous, they took in all our baggage, we were under weight, and we were free to go for a security check. The boys were also very kind to us. After the check we were taken to the Gate and made us comfortable. When boarding was announced we were given priority, which I found was very amazing. The cabin crew was also very helpful kind courteous and pleasant. The food served was fresh and sumptuous. We are very happy we flew Vistara. On landing at Hyderabad wheelchairs were available and the ladies taking us were also very good and kind. Our return from Hyderabad to Pune on 22nd we experienced the same good treatment all along. Thank you Vistara for taking so much care of us, senior citizens. I have recommended your Airlines to all my friends and relatives. My agent did not know that Defence gets a discount but anyway next time we shall avail of the facility. Best wishes"
brb474 wrote a review May 2019,50,New Delhi - Srinagar,Domestic,Premium Economy,Best domestic airline in India...,"Very friendly check-in, early boarding, departure ahead of schedule, arrival on time, quick inflight service, excellent food qualitiy, friendly staff, brand new airplane, absolutely nothing to complain about."
Amitabh Chakraborty wrote a review May 2019,50,Bengaluru - Mumbai,Domestic,Premium Economy,Delighted,"Never traveled with this airlines, but I am now converted. Everything of the airlines exudes professionalism. On time take off and landing, excellent in flight service, good food, in my opinion premium economy was full value for money. Bit it us expected with pedigree of Tata and Singapore Airlines!"
Mudhit G wrote a review May 2019,50,Mumbai - New Delhi,Domestic,Premium Economy,Amazing Premium Economy,The only Domestic airline to have a premium economy option. Superb value for money. Very comfortable seats. Good food and excellent service. Cant ask for more!
ChennaiShaji wrote a review May 2019,50,New Delhi - Chennai,Domestic,Economy,Great Travel experience with all women crew,"While boarding, I noticed that the cockpit was managed by two women Pilots. The crew were all Ladies. Excellent service, smooth flight and smooth landing too.
The complimentary meal was good - the quantity could have been a bit more.
Though the flight was slightly late, they did communicate to us - which is appreciated."
mangal singh wrote a review May 2019,40,New Delhi - Chennai,Domestic,Economy,best services,"Delhi to Chennai. Spacious seats, early boarding and on time departure and arrival made for a positive first impression. My wife, son and I flew Vistara because of the higher quality of service and in flight food, because that's one less thing to deal. We were late to the baggage claim belt and Vistara had staff trying to contact me by phone and were even able to contact my family to ensure we got our checked in baggage. What more can one ask for these days. Highly recommended."
Traveller Mehedi wrote a review May 2019,50,New Delhi - Leh,Domestic,Economy,Relaxed and Enjoyable Flight,Inside the airplane everything was well decorated. Crews were cordial to their services.There was complementary breakfast with flight.I took this flight during my trip to Ladakh.I enjoyed this journey.
irina_kahlon wrote a review May 2019,40,Mumbai - New Delhi,Domestic,Premium Economy,Courteous staff and efficient flights,"Lately, I prefer to travel by Vistara as the service is good, the staff is polite and efficient and most importantly, the flights have so far, been on time. The rows also have more legroom than Indigo which just has terribly squashed seating.

However, there isn't much difference between the Premium economy and Economy, so I don't see the sense in paying extra for a hand towel and minor frills."
Chad S wrote a review May 2019,10,Mumbai - Bengaluru,Domestic,Premium Economy,Terrible training or systems communication for cancellation,"You are all aware of the Jet Airways grounding its flights, so one of the legs of my international trips from Mumbai to Bengaluru was canceled. So I booked that leg on Air Vistara on April 20th for the date of June 14th. I was charged $429 with the charge reading Tata SIA Airlines... on my credit card. Since Jet Airways held the rights to all my legs on my international trip, my whole trip to India got canceled. So I called Air Vistara on April 30th to cancel the Mumbai to Bengaluru leg.

Since my fare was a Premium Economy Flexi Fare, the person who spoke to me assured me that there would be no cancellation charges and that I would receive my refund to the credit card. I call AGAIN today, May 2nd, and they have absolutely no documentation of that call on April 30th. Somehow my flight has been magically canceled but with no confirmation email for cancellation (I know my email works since I reset my password for my Air Vistara online account yesterday to make sure it works).

The person who spoke to me today told me that it was canceled because they did not receive any funds from my credit card. I see the charge bright and clear today for the $429 for 3 passengers charged to my credit card with a foreign transaction fee of $12 and change as well from April 20th, sitting today on May 2nd.

Now, what I thought would have been an easy cancellation for most airlines for a recent reservation turns out to be a nightmare for me having to spend extra time to dispute the charge with my credit card thanks to Air Vistara's ineptitude. Either, they need their folks to respond with email notifications for every call or have better training for their phone systems to communicate with their database, wherever the problem lies.

Extremely disappointed and mad that I had to go through this!!! Maybe I will cancel directly on their website next time, but who knows if that would work in refunding my credit card."
Sanjay wrote a review May 2019,50,Chandigarh - New Delhi,Domestic,Premium Economy,No frills punctual service,"We chose to take the 45 flight to Delhi from Chandigarh as opposed to driving there in order to save time. All in all a great experience. Security was a breeze, boarding was unusually civil (a rarity in India) and the staff on board were polite and helpful - they did their best to serve and clear up any rubbish all within the 45 minute window which I thought was commendable. Next time I am travelling domestically in India, I will choose Vistara. Hoping they launch international services soon!"
kapilnice1 wrote a review May 2019,50,Kochi (Cochin) - New Delhi,Domestic,Economy,"Excellent staff, legroom, food and comfort","The staff was very polite, professional, helpful and courteous.

Food was very fresh and nice. Also, the legroom was much better than other airlines flying on the same route."
Rajesh_in wrote a review Apr 2019,30,New Delhi - Hyderabad,Domestic,Business Class,Insulting Staff Behaviour in Business Class,"I have reviewed this airline in the past and have always found it to be one of the best in India, and for that matter across the world. Overall service levels have been very good .

Which is why I was taken aback due to the insulting behaviour by one of the cabin crew ( name I did not ask) on my recent trip from New Delhi to Hyderabad UK 899 on 27th April, 2019. This happened in Business Class.

This happened while I had just boarded the flight and the rest of the boarding was going on. I had just settled in my seat and was going through my phone . I am not sure what prompted this crew member to come to me and accused me of taking pictures of the crew members. I was shocked and taken aback by the tone and the manner in which she accused me. I offered my phone to her and asked her to check my images gallery. She did not check and went back to her boarding duties.

I have traveled across the world and in multiple airlines ,but never faced this kind of rude behaviour by a crew member. As soon as the boarding was completed , I sought out the cabin crew in charge and complained to her about her staff's rude behaviour. She said that she had already told the staff not to speak in this tone. As the flight took off , the crew member , who had insulted me, came to apologies and said sorry. I told her my issue with the way she spoke to me, which was absolutely not acceptable.

I hope Air Vistara takes note of this incident and takes enough precautions and staff training. I hope this is an odd experience out and does not become a regular feature."
akhan37 wrote a review Apr 2019,10,New Delhi - Srinagar,Domestic,Business Class,HORRIBLE CUSTOMER SERVICE,"First time traveller and was flying in from an international flight. I bought excess baggage prior to the flight. On check in at the air port, AIR VISTARA staff informed me to upgrade to business class instead and a Refund will be issued for the excess baggage. After my flight and not received any refunds I have called at least 4 times only to find they have no system of tracking incoming service requests and had to explain the situation 4 time to 4 different people and still have not received any correspondence from AIR VISTARA."
K. Sharma wrote a review Apr 2019,50,New Delhi - Chandigarh,Domestic,Business Class,Vistara airline flight experience,"Excellent flight, well managed plane, experience and very friendly crew members. Flight was on time in departure and arrival. Although it was a short flight but enjoyed every moment of it."
ankit d wrote a review Apr 2019,50,Kochi (Cochin) - New Delhi,Domestic,Economy,Best Airline in the World,"The laat time i travelled with Vistara was probably a year ago and they were fairly new at that time and I was a little doubtful if they would maintain the same class for long..However my doubts were cleared on my Recent flight with them again On KOCHI-DELHI sector and I was pleasently surprised with the quality being much improved and still as impeccable as it was.The food was amazing and in good quantity..the boarding was done very nicely with Business class first,Premium Eco second and Eco Third it caused no chaos and was very swift.

I cant wait for Vistara to travel abroad."
KumarMorjaria wrote a review Apr 2019,50,Chennai - Port Blair,Domestic,Business Class,Brilliant service and flights!,We were offered to purchase an upgrade to business class on both trips which we accepted to treat ourselves being our 60th birthdays. The check in was very smooth and efficient on all counts. Economy class was also being swiftly processed. In flight service was very courteous and friendly. Food was tasty and mocktails were nice. No alcohol is served on the flight which was fine by us. The aircraft was clean and tidy and the crew take great pride in the jobs they carry out. We thoroughly enjoyed our experience with this airline and we do fly a lot to different parts of the world but Vistara has set the bar quite high for the others to follow.In conclusion I will say keep up the good work and will fly with you next time I am in your fly zone.
