Tony C wrote a review Apr 2019,30,New Delhi - Varanasi,Domestic,Economy,Functional but beware weight restrictions.,"We took a short flight of little more than an hour which provided an overall fond experience with surprisingly food provided on the short journey.
The downside is (alongside other internal Indian flights) is a weight restriction of 15 kilos which is tough when you are on a multi week tour of India. This appears to be strictly managed and does appear to be a money making exercise. Strangely they don’t appear to manage hand luggage so this does make a cabin bag space at a premium."
Ashishmittal28 wrote a review Apr 2019,40,Mumbai - New Delhi,Domestic,Economy,Delhi to Mumbai and return,I traveled in Air Vistara from Delhi to Mumbai and back. It is always pleasure experience to fly with Vistara. Presently this the best airline who are handled their passengers more professionally. Catch you soon again.
HFKtheone wrote a review Apr 2019,40,New Delhi - Bengaluru,Domestic,Premium Economy,Impressive,"I recently took my boss last Sunday on Vistara Prem Eco. Proud to have a full service airline in the country especially since the only other one is Air India. Let me compare:
1) Call center - Vistara may take a little extra time but get yr work done in one go. Air India difficult to connect and they definitely do you several favors by listening to you and you should feel obliged (I'm being sarcastic in case you have not got it).

2) Vistara check in: Awesome experience. I've checked into to Jet and Air India on biz class. AI as usiual does you a favor. Jet was nice but slightly arrogant, Vistara is friendly and you are glad to be there.

3) Food: Vistara serves you a full meal Veg and non Veg. AI only Veg on domestic flights

4) Unlike other European airlines, premium eco seats here are really premium eco and very very comfortable. No one else in India has prem eco seats

5) EVen the economy is good.

6) The only area where AI scores more is leg space in economy.

I would always prefer flying Vistara but subject to my co rules."
kamakshi2015 wrote a review Apr 2019,50,New Delhi - Guwahati,Domestic,Economy,The great airline !,This new entrant on the Indian skies is an impressive flying experience . The check in the landing - in flight comfort was very good . The courtesy of the crew was pleasant and thoroughly professional . The punctuality and the update of the flight was a constant reminder . The airfares are compititive with the rest of the other airlines .
Alexandra B wrote a review Apr 2019,20,New Delhi - Hyderabad,Domestic,Economy,Good company but poor customer service and complaint resolution,"I had a journey from Hyderabad to Delhi. The company is great overall, but on my return flight, I got sick with the in-flight meal few moments after the landing. I wrote to the Customer Service, explaining the issue. And let me say that the reply wasn't really up to the standards they're claiming.

All I was provided were copy/pasted e-mails saying that they are really sorry (me too btw, being sick for an entire week isn't really the most appreciable thing in the world to experience), but since no one experienced the same symptoms, well to bad for me. Oh, and I should have advised the crew on board, which is a really enlightened advise to say on a short flight (Less than 2 hours). So to recap, they are really sorry, they hope I will book again with them without actually taking really seriously the issue I was reporting.

So overall it's a decent flight company, until you have a serious issue. Don't count on them to use their common sense to resolve a failure from their side, which is a bit concerning to retain clients."
SK3731 wrote a review Apr 2019,50,Guwahati - New Delhi,Domestic,Premium Economy,Guwahati to Delhi by Vistara,Me along with my wife travelled in Vistara flight in Premium Economy class from Guwahati to Delhi. It was a very smooth experience. Flight was very comfortable. Crew extended due courtesy and served well. Flight reached on time. Overall a good experience
Sharmila Bapna wrote a review Apr 2019,40,New Delhi - Bagdogra,Domestic,Economy,Smooth flight.. courteous staff,"We flew Vistara from New Delhi to Bagdogra and way back. The flight was super smooth and ground staff is super courteous. From Check In to Boarding and De boarding we were assisted with smiling faces. Our return flight timing were changed and we were getting constant but courteous reminder to make sure we do not miss flight.

Food was fresh and hygienic, loved desserts both time."
Tominindia wrote a review Apr 2019,50,New Delhi - Varanasi,Domestic,Economy,Truly surprising.,"Having had a couple of questionable flight experiences recently out of India, I approached this internal flight with caution. I was thrilled with the check in service, legroom, quality of catering and all other experiences with this airline. Left of time to the second and even arrived early, they even gave me KrisWorld ff miles. 10/10 completely recommend."
Amarnath M wrote a review Apr 2019,40,New Delhi - Bhubaneswar,Domestic,Economy,Very good flying experience,"Staff was good. They obliged when I asked to transfer my pre-booked meal to a co-passenger (it was a corporate booking for me and hence I didn't let my meal go waste; usually I only take the snack items on a flight but Vistara won't give me that on pre-booked meal option). Toilets are less-spacious, which is surprising as the passenger's seat leg room is quite good. Otherwise, comfortable flight. I had no check-in luggage, so can't comment on that."
Radha L wrote a review Apr 2019,50,Hyderabad - New Delhi,Domestic,Economy,Excellent service,"One of the best airline services in India, Good legspace and comfort; also excellent reception and service. Vistara should expand into many more routes."
Eva wrote a review Apr 2019,10,Mumbai - New Delhi,Domestic,Economy,Awful baggage experience,"If there was no helpful ground lady staff in Delhi, I would have given 0 star if I could. BTW One awful unhelpful ground man staff in Delhi called Maniskuphta. My bag was not flying with me, I had to wait for the next flight (18.00) to get my bag while I got a bus to catch at 1915. While my bag was out, the baggage tag was put in other stranger baggage. How professional Vistara work. Totally left big impression to my 1st Indian domestic airlines. Until 18.20 my bag came out."
Gowri V wrote a review Apr 2019,30,Chennai - New Delhi,Domestic,Premium Economy,Over all experience,"Overall experience was Good. Timely departure and convenient flight arrangements right from Check in to Boarding.

Good In flight service, satisfied Journey."
An Unindentured Adventurer wrote a review Apr 2019,50,New Delhi - Goa,Domestic,Economy,Pleasantly surprised,"We took a domestic flight from Delhi to Goa. It was a 2 hour flight. The carrier had business, premium economy and economy class. From check in, to boarding, friendly and efficient staff. On a domestic flight, we were not expecting a meal service. I was very pleasantly surprised to have a meal on board. I felt for the cost of your ticket, the meal provided was of exceptional quality.
You are served a bread, warm main and a dessert. You also have veg or non veg choice. They also have inflight entertainment onboard, which again is a marvelous add on service. I would definitely use Vistara, when I travel in India again."
Saqib wrote a review Apr 2019,50,New Delhi - Srinagar,Domestic,Economy,Very Comfortable,"I have fly form Delhi to Srinagar , best airways, nice cabin crews, good services. clean airplane, nice staff, you get hand luggage as well as check in luggage included in price. No LCD for entertainment, you download an app where you can get entertainment to view on your cell phone."
Dr Rajib Mukherjee wrote a review Apr 2019,50,Port Blair - Kolkata,Domestic,Economy,Excellent experience,"Excellent flawless experience while flying along with family,,,food quality I will like to share is the best among the categories..."
mkrettiwt wrote a review Apr 2019,50,New Delhi - Pune,Domestic,Premium Economy,Excellent service,"Really pleased to travel by Vistara on domestic flights in India in last couple of weeks. Well kept planes, excellent service. Well above the rest. Highly recommended."
PMM wrote a review Apr 2019,50,New Delhi - Bhubaneswar,Domestic,Economy,Friendly airline,"Excellent service and on time.Food served was good and the staff is friendly.
Can improve their uniform though"
SteveWdhd wrote a review Apr 2019,50,Goa - New Delhi,Domestic,Premium Economy,A Cut Above the Others,"We flew from Goa to Delhi with Vistara in March 2019. Having flown with most of the other Indian airlines in the past, Vistara are definitely a cut above the rest (including Air India). We had a good meal, attentive staff, and a punctual, smooth flight. The upgrade to Premium Economy was very good value. We'd definitely use Vistara again, in preference to other airlines in India."
Travellor wrote a review Apr 2019,10,New Delhi - Ranchi,Domestic,Economy,Rip Off,Booked to connect my international flight only to find out that I had to pay for my excess baggage @500/kg with additional 500 for handing fee. Other airlines have always allowed me to carry additional baggage when connecting to/from international destinations. Ended up paying 3x my original ticket price.. Complete Rip Off
Khushroo wrote a review Apr 2019,40,New Delhi - Mumbai,Domestic,Premium Economy,Classy Domestic Airline,Vistara has been my preferred domestic airline as it is part of Singapore Airlines which is a Star Alliance partner & one of the most elite airlines in the world. Vistara has maintained its standard & the aircrafts are new & the leg space also very comfortable. Inflight food is also very good. It is a very pleasant experience to travel by Vistara.
yogesh thadani wrote a review Apr 2019,40,New Delhi - Mumbai,Domestic,Premium Economy,vistara is a good airline,"the staff at check in was polite. i am a wheel chair passenger and was travelling with my
wife and daugher .. the wheel chair was arranged fast. boarding was good. seats comfortable. the food at premiium economy was excellant.
at mumbai airport normally wheel chair takes time to come with other airlines
but with vistara it was already waiting .. even offloading the baggage i was given help
i stay in cameroun west africa and visit india every 2 months and have to travel mumbai delhi chennai pune and always look forward for a vistara flight"
Ajay KMehta wrote a review Apr 2019,50,New Delhi - Chandigarh,Domestic,Premium Economy,Great Airline,"One of the nicest Domestic airline i have travelled in anywhere in the world and that includes U.S.A,U.K,Germany etc.Very nice spacious seats to fit my 6 feet frame.Very good service and nice snacks even though did not use them."
SM0207 wrote a review Apr 2019,50,New Delhi - Kolkata,Domestic,Economy,Delightful experience,"I travelled on Vistara UK711 del to kol on 7.4.19 and had an wonderful experience . I was carrying a canvas painting which could not be accommodated in cabin baggage due to large size and I was deeply worried that the painting will get damaged if it is checked in luggage . I made the request at the check in counter and handed over my dear painting with lots of apprehension. To my delight , the painting was given a different treatment and it was carried in a separate manner and vistara team ensured the painting is well taken care off . To my surprise even while I was waiting for my painting on the baggage belt, it was brought to me separately without being put on the belt . I m really thankful to all the concerned persons who had taken the extra efforts to ensure the safe arrival of my painting ."
Nancy D wrote a review Apr 2019,50,New Delhi - Varanasi,Domestic,Business Class,Vistara really is a star for Inter-India flights,"While trying to find a flight I could trust to be on time (other Indian airlines to smaller cities in my experience can be notorious with cancellations and long delays) I found Vistara. Given that they are a party owned by Singapore Airlines I gave them a try. Glad I did. I was pleasantly surprised with how modern the plane was, the quality of service (full meal in all classes, even on a 90 minute flight), but most important they were on time/schedule. I flew 2 more Vistara flights after this one (Varanasi to Delhi and Delhi to Bangalore) and the experience was repeated. If you need to travel inter-India this would be a great choice."
Kevin R wrote a review Apr 2019,50,New Delhi - Leh,Domestic,Economy,First class even in economy!,"I flew from Delhi to Leh ( return) with Vistara for the first time last August, 2018. I was not familiar with Vistara prior to these flights and was a tad nervous flying with an airline I did not know. What a wonderful surprise for me!! The aircraft was a new airplane. It even smelled spanking new. :)The flight attendants were welcoming and very professional. Even though it was a short flight, a meal was served which was much appreciated. I would highly recommend this airline! What a welcoming change over the national airline which serves very poor service."
Hsanghavi wrote a review Apr 2019,50,New Delhi - Mumbai,Domestic,Economy,"Excellent Service, Spacious Economy Legroom, Excellent Staff","Excellent Staff
Excellent Service
Super Legroom
Good Food Choice
Legroom and Seat reclining was very spacious in Econmy. Did not feel cramped as in other airlines."
Sunil W wrote a review Apr 2019,40,Ahmedabad - Bengaluru,Domestic,Economy,Better airline in the current lot of airlines in India,"The flight was running late, but no announcement, though Ahmadabad is not a silent airport, neither the display board was showing it as late.
The ground crew i.e. at check in counters, at the boarding gates was not well trained and there was a total confusion and lot of time taken for check in as well as in orderly boarding.
If the staff is well trained, then there is a possibility for Vistara to achieve a greater customer satisfaction."
Ritwick S wrote a review Apr 2019,50,New Delhi - Bhubaneswar,Domestic,Business Class,Best Airlines now in India,"We were four of us with one business class and three premier economy class tickets. So everything was smooth, right from check in to baggage collection. Have to praise the food in the business class and premier economy class. Service was first class too. This is my preferred airlines for flying in India"
Deepak C wrote a review Apr 2019,50,Ahmedabad - New Delhi,Domestic,Premium Economy,Great Experience,"I was flying with my family and when you have booked with Vistara,you go with certain expectations and Vistara did not disappoint. Everything from Check in to Food to Cabin crew was perfect."
explorer_too wrote a review Apr 2019,10,Mumbai - New Delhi,Domestic,Business Class,Picky picky late late,"Isn’t this supposed to be a good customer service friendly airline?
I don’t know, maybe the agents did not the memo. Starting with check in to boarding the plane bad experience. For half a kg of excess they made me check in my handbag, mind you this is the same bag I had carried on jet airways on in-going flight. They turned around the late incoming aircraft with no cleaning the aircraft.

To top it all they took an hour to get the baggage onto carousel on arrival. Never again Vistara"
ward27342 wrote a review Apr 2019,50,New Delhi - Pune,Domestic,Economy,Excellent,"I’ve travelled on a few Airlines through India but this new Airline was a class above. Well staffed with very courteous but firm ( no you can’t change seats until all the passengers are boarded , no we are boarding row 19 - 26 please wait until your row is boarding) staff. They seemed to have staffed to the proper level consequently both the outward and return flights left on time. I must admit it was a pleasure to travel with them"
Amolak Rattan K wrote a review Apr 2019,50,New Delhi - Chandigarh,Domestic,Business Class,Very courteous and punctual service,"Reception was superb and a courteous staff helped us for smooth check in and escorted us to the lounge. The food in the lounge was delicious and tasty. After a nice meal again escorted to the departure lounge for boarding. The cabin crew was excellent in every service. Had a smooth experience and love to travel again.
Amolak Rattan Kohli
Former Governor of Mizoram"
misshotelreviewer wrote a review Apr 2019,40,New Delhi - Ahmedabad,Domestic,Economy,Highly recommend the airlines. One of the best low cost carrier,"Given the number of low cost carriers in the country, Vistara is one of the best. Their service is excellent and the staff is courteous and helpful. They are high in cleanliness and are always on time. The food and beverage offered was fresh and delicious and passengers did not have to pay for the same. The crew was patient, helpful and well trained. Flying Vistara is indeed value for money. Plus, the airplane had a very smooth take off and landing which came as a surprise compared to the way other carriers land and almost throw you out of your seat!"
Ashvin Parekh wrote a review Apr 2019,40,Mumbai - New Delhi,Domestic,Business Class,"Highly recommended. Good, efficient crew.","I did a return trip between 17th and 18th March. Very nice experience. After the uncertainty arising out of Jetairways i have switched to Vistara. Nice seats, good food and very efficient staff. More significantly. reliable and with punctuality record. The flights both ways were on time."
captsanjiv007 wrote a review Apr 2019,50,New Delhi - Raipur,Domestic,Premium Economy,One of best airlines in the world,This Airlines is amazing service extra ordinary customer service. Food was superb and offocoase crew was even Awesome. Thank you so much for such a adorable flying experience.
sheikh Irshad Ahmad wrote a review Apr 2019,50,New Delhi - Srinagar,Domestic,Premium Economy,Beautiful.,"After enjoying the first time travel in the world class Vistara, I would recommend it to everyone. Splendid service, magestic knowhow, on time taking off add to the beauty of the Vistara."
TALWARR wrote a review Mar 2019,50,New Delhi - Kochi (Cochin),Domestic,Premium Economy,Vistara exceeded my expectations,Flight was great. Left on time and landed on time. On board service was excellent. Aircraft was clean and comfortable. Food was good. Can't fault in any way.
Pawan Khatri wrote a review Mar 2019,40,New Delhi - Bengaluru,Domestic,Economy,Good,"We traveled Delhi to Bengaluru in uk 811 on 26th March and Bengaluru to delhi in uk 820 on 30th March. Good Experience, good food, on time performance, efficient staff all was good, but seats of Economy class is like other local airlines nothing special no extra legroom."
Nandini wrote a review Mar 2019,50,New Delhi - Kolkata,Domestic,Economy,Pleasure indeed,"Flight was clean and on time. Service prompt. Efficiency was it its best. Meals and beverages served on time. I bought some fkavoured xashews and almonds boxes on flight and they were worth it. Not expensive yet of a high quality.

Suggestions - for small children, it would be nice if a toy or a book is given to them as a gift. Wish the inflight attendants and air hostesses could smile a little. The food as dinner, MUST be better- the sweet was unacceptable and the chicken preparation served with rice was spicy.
Since the idea of flight is not food, i gave a high rating.
For a genuine reason and in the same day of booking if one needs to cancel or modify the booking, it must be allowed free of cost with NO deduction whatsoever."
abbyjal wrote a review Mar 2019,50,Bagdogra - New Delhi,Domestic,Economy,Awesome Experience in Air Vistara,"I traveled in UK 726 on 23rd March 2019 from Bagdogra to Delhi, the flight was really awesome with comfortable seats, the hospitality was really recommendable, the complimentary foods was very very tasty and good menu. Timely departure and timely arrival made our journey more comfortable. I will always prefer Air Vistara for all my future travel and highly recommended."
YourSunshine wrote a review Mar 2019,40,Pune - New Delhi,Domestic,Economy,Recent Experience - Is the Airline going the way of the others?,"Flying Air Vistara for me has always been a pleasure. But recently I have noticed small changes in customer relations. The last one left me absolutely upset. I was flying at a time when there was enhanced security at the airport post the Balakot surgical strike and terrorist attacks were expected. The airline therefore issued an advisory to flyers to carry the very minimum in hand and made an allowance to club the weight permitted for cabin baggage with check in baggage. Which meant if you are allowed 15 kgs check in, you could add in 7 kgs permitted for cabin baggage and it would be fine to carry 22 kgs check in. From Delhi to Pune, there was no problem. However, from Pune to Delhi, it seems the airline staff at the airport had no clue about the advisory or how the weight was to be managed and for one hour the Customer Service Manager would not accept any explanation. I had in fact double checked with the customer relations helpline before packing if the advisory was still in place and it was ok to check in 22 kgs and the same was confirmed to me. In fact I had only 19 kgs and no hand baggage. But this man insisted on refusing to accept my baggage and I felt really humiliated and insulted in front of all the passengers checking in. I had arrived first at the check in counter and and hour later when almost all passengers were through security, finally the aiport manager made an appearance. I once again retrieved the advisory and made them both read it and speak to the supervisor at the customer service helpline, after which they sheepishly checked in for me and gave me my boarding pass. The CS Manager was not one bit apologetic and still did not think he was wrong. I took up the matter with the Nodal Officer who promised to take action. It is now over two weeks, I still have not heard from them about what action was taken. At the end it seems that Customer Relations is only about saying some sweet words to the customer and getting away."
Suvrojit S wrote a review Mar 2019,40,New Delhi - Pune,Domestic,Premium Economy,FLYING WITH VISTARA,"with Jet Airways going through a turmoil, Vistara should fill up the vaccum. They are a good airlines who take proper care of their passengers."
Pradeep S wrote a review Mar 2019,50,New Delhi - Ahmedabad,Domestic,Economy,Good experience.,Definitely a cut above it's competitors. Given a choice i would always prefer Vistara. Good in all respects.
palit wrote a review Mar 2019,50,New Delhi - Mumbai,Domestic,Economy,Best private airline of india that keeps time.,Polite ground staff and excellent cabin crew. Seats were comfortable food was great and plenty of drinking water served. Over all best possible service in Indian private sector airlines. Staff are well trained and smiles and helpful too. What more do you want. They kept time too and baggage handling superb. A big thumbs up.
Prowander wrote a review Mar 2019,10,Kochi (Cochin) - New Delhi,Domestic,Economy,Upgrade system is a ripoff,"The airline collects a fee for being put on the list of passengers interested in purchasing an upgrade. in reality, there was no chance that we were going to get an upgrade but the airline collected the fee anyway. I found it to be a complete scam. We were traveling in a group and no one got an upgrade. Terrible."
Prowander wrote a review Mar 2019,30,New Delhi - Kochi (Cochin),Domestic,Economy,Uncomfortable economy,"Economy class is total an uncomfortable way to travel. The seat have no leg room and the seats are uncomfortable. Unlike other airlines, headrests are not adjustable."
Abhishek wrote a review Mar 2019,50,New Delhi - Mumbai,Domestic,Premium Economy,"""Fly the new Feeling""","I have travelled to numerous destination in various flights, but Vistara is the best i have ever flown. This review is based on my first experience onboard Vistara. To be honest i had very little expectation from this airline and was also a little excited about it. The very first thing notified my eyes was the smiling crew (ground-staff included). The crew onboard were professional from the origin to the destination. The food was good and cleanliness was maintained. All in all I had a delightful experience. I happily signed up for the frequent flyer program (Club Vistara) and I'm pretty much enjoying the CV privileges. Nowadays, my travel starts with Vistara and ends with Vistara. I truly have ""Flown the new Feeling"" and now it's your turn. I highly recommend flying you Vistara. Happy flying!!"
F_A_R_A_Z wrote a review Mar 2019,40,Port Blair - Kolkata,Domestic,Economy,Excellent service and dedicated team,"Thank you UK778 for getting me home despite adverse weather conditions. And special thanks to Sushmita and Sweta. One suggestion to the team please change the chicken patty served on board.
Regards Faraz"
Satyajeet M wrote a review Mar 2019,40,Chennai - Kolkata,Domestic,Economy,No electronic display,"I travel frequently and like this airline for their service and punctuality.
But this time I bit disappointed of their not displaying any degetal signage at checking get, many people get confused about this....."
